{
  "$schema": "../schema/deck.schema.json",
  "id": "realms_starter",
  "name": "Realms Vanguard",
  "faction": "realms",
  "leader": "legion_commander",
  "cards": {
    "sven": 1,
    "crystal_maiden": 1,
    "roshan": 1,
    "omniknight": 1,
    "chen": 1,
    "riki": 2,
    "bronze_legion_standard_bearer": 1,
    "drow_ranger": 1,
    "invoker": 1,
    "lina": 1,
    "kunkka": 1,
    "windranger": 1,
    "marci": 1,
    "beastmaster": 1,
    "dragon_knight": 1,
    "claddish_cannoneer": 3,
    "phantom_lancer": 3,
    "radiant_melee_creep": 3,
    "radiant_ranged_creep": 2,
    "radiant_catapult": 1,
    "drum_of_endurance": 1,
    "laguna_blade": 1,
    "manta_style": 2,
    "freezing_field": 1,
    "smoke_of_deceit": 1,
    "ravage": 1,
    "sunstrike": 1
  }
}
